{
  "iso": "DO",
  "name": "Dominican Republic",
  "has_exam": true,
  "exam_name": "Examen de cultura general dominicana",
  "administering_agency": "Ministerio de Interior y Policía",
  "format": null,
  "languages": ["es"],
  "regional_variants": [],
  "exemptions": {
    "age": null,
    "disability": null
  },
  "fee": {
    "amount": 29200,
    "currency": "DOP",
    "covers": "The whole ordinary naturalization process: review, application, the right to sit the examination and the oath."
  },
  "official_study_material": [],
  "last_researched_at": "2026-10-08T00:00:00Z",
  "citations": {
    "has_exam": ["https://mip.gob.do/servicios/naturalizacion-ordinaria/"],
    "exam_name": ["https://mip.gob.do/servicios/naturalizacion-ordinaria/"],
    "administering_agency": ["https://mip.gob.do/servicios/naturalizacion-ordinaria/"],
    "languages": ["https://mip.gob.do/servicios/naturalizacion-ordinaria/"],
    "fee": ["https://mip.gob.do/servicios/naturalizacion-ordinaria/"]
  },
  "unverified": {
    "regional_variants": "None described: one national test.",
    "format": "The page gives no numbers.",
    "exemptions": "Not read.",
    "official_study_material": "The questionnaire is handed to applicants in person; nothing is published online."
  },
  "confidence": "high",
  "recent_change": null,
  "notes": "The ministry says the questionnaire for the general-culture evaluation is handed over when the file is deposited; it is not published online. An interview in Spanish is also held."
}
