{
  "iso": "PA",
  "name": "Panama",
  "has_exam": true,
  "exam_name": "Examen de aspirantes a la nacionalidad panameña",
  "administering_agency": "Tribunal Electoral",
  "format": null,
  "languages": ["es"],
  "regional_variants": [],
  "exemptions": {
    "age": null,
    "disability": null
  },
  "fee": null,
  "official_study_material": [
    {
      "title": "Temario de estudio: examen de aspirantes a la nacionalidad panameña",
      "url": "https://www.tribunal-electoral.gob.pa/wp-content/uploads/2017/08/Temario-de-estudio-examen-de-aspirantes-a-la-nacionalidad-paname%C3%B1a.pdf",
      "publisher": "Tribunal Electoral",
      "kind": "other",
      "language": "es",
      "license": null,
      "reusable": "unclear"
    }
  ],
  "last_researched_at": "2026-10-08T00:00:00Z",
  "citations": {
    "has_exam": [
      "https://www.tribunal-electoral.gob.pa/wp-content/uploads/2017/08/Temario-de-estudio-examen-de-aspirantes-a-la-nacionalidad-paname%C3%B1a.pdf"
    ],
    "exam_name": [
      "https://www.tribunal-electoral.gob.pa/wp-content/uploads/2017/08/Temario-de-estudio-examen-de-aspirantes-a-la-nacionalidad-paname%C3%B1a.pdf"
    ],
    "administering_agency": [
      "https://www.tribunal-electoral.gob.pa/wp-content/uploads/2017/08/Temario-de-estudio-examen-de-aspirantes-a-la-nacionalidad-paname%C3%B1a.pdf"
    ],
    "official_study_material": [
      "https://www.tribunal-electoral.gob.pa/wp-content/uploads/2017/08/Temario-de-estudio-examen-de-aspirantes-a-la-nacionalidad-paname%C3%B1a.pdf"
    ]
  },
  "unverified": {
    "regional_variants": "None described: one national test.",
    "fee": "Not read.",
    "exemptions": "Not read.",
    "format": "Not published in what was found.",
    "languages": "Assumed from the Spanish syllabus."
  },
  "confidence": "medium",
  "recent_change": null,
  "notes": "The electoral tribunal’s syllabus (civics, geography, history) was found by search on its site, but the site refused the download, so its content is known only from the search summary."
}
