{
  "iso": "CH",
  "name": "Switzerland",
  "has_exam": true,
  "exam_name": "Grundkenntnistest (canton of Zürich); the name and form differ by canton and commune",
  "administering_agency": "The canton and the commune of residence",
  "format": null,
  "languages": ["de"],
  "regional_variants": [
    {
      "region": "CH-ZH",
      "name": "Zürich",
      "note": "Applicants must show basic knowledge of the geography, politics, history and society of Switzerland, of the canton and of its communes; the Grundkenntnistest is one way to prove it."
    }
  ],
  "exemptions": {
    "age": null,
    "disability": null
  },
  "fee": null,
  "official_study_material": [],
  "last_researched_at": "2026-10-08T00:00:00Z",
  "citations": {
    "has_exam": [
      "https://www.sem.admin.ch/sem/en/home/integration-einbuergerung/schweizer-werden/ordentlich.html",
      "https://www.zh.ch/de/migration-integration/einbuergerung/ordentliche-einbuergerung.html"
    ],
    "exam_name": [
      "https://www.zh.ch/de/migration-integration/einbuergerung/ordentliche-einbuergerung.html"
    ],
    "administering_agency": [
      "https://www.sem.admin.ch/sem/en/home/integration-einbuergerung/schweizer-werden/ordentlich.html"
    ],
    "regional_variants": [
      "https://www.sem.admin.ch/sem/en/home/integration-einbuergerung/schweizer-werden/ordentlich.html",
      "https://www.zh.ch/de/migration-integration/einbuergerung/ordentliche-einbuergerung.html"
    ]
  },
  "unverified": {
    "format": "There is no national format: each canton sets its own. Zürich’s test page was not read beyond its existence.",
    "languages": "German for Zürich, the only canton read; other cantons use their own official language.",
    "fee": "Zürich lists cantonal and communal naturalization fees; none for the test alone was read.",
    "exemptions": "Not read.",
    "official_study_material": "Not read."
  },
  "confidence": "medium",
  "recent_change": null,
  "notes": "Federal law leaves the check to the cantons: the federal office says the canton verifies that the applicant is integrated and \"familiar with the Swiss way of life\" and may add requirements. Only Zürich was read here. The other 25 cantons each need their own entry before this profile is complete."
}
