{
  "iso": "PE",
  "name": "Peru",
  "has_exam": true,
  "exam_name": null,
  "administering_agency": "Superintendencia Nacional de Migraciones",
  "format": null,
  "languages": ["es"],
  "regional_variants": [],
  "exemptions": {
    "age": null,
    "disability": null
  },
  "fee": null,
  "official_study_material": [],
  "last_researched_at": "2026-10-08T00:00:00Z",
  "citations": {
    "has_exam": [
      "https://www.gob.pe/institucion/migraciones/noticias/1227835-conoce-los-principales-cambios-en-la-nueva-ley-de-nacionalidad"
    ],
    "administering_agency": [
      "https://www.gob.pe/institucion/migraciones/noticias/1227835-conoce-los-principales-cambios-en-la-nueva-ley-de-nacionalidad"
    ]
  },
  "unverified": {
    "exam_name": "The notice calls it an \"evaluación\" of language and of knowledge of history, geography, the Constitution, culture and current affairs; no formal name is given.",
    "regional_variants": "None described: one national test.",
    "fee": "Not read.",
    "exemptions": "Not read.",
    "format": "To be set by the regulation of the new law, which was still in consultation.",
    "official_study_material": "None found.",
    "languages": "Assumed Spanish."
  },
  "confidence": "medium",
  "recent_change": {
    "changed_on": "2025-08-16",
    "summary": "A new nationality law, Ley N.° 32421, replaced the old one: longer residence, an income threshold, and an evaluation of language and of history, geography, the Constitution, culture and current affairs. Applications already under way continue under the old law.",
    "url": "https://www.gob.pe/institucion/migraciones/noticias/1227835-conoce-los-principales-cambios-en-la-nueva-ley-de-nacionalidad"
  },
  "notes": null
}
