{
  "iso": "EC",
  "name": "Ecuador",
  "has_exam": true,
  "exam_name": "Examen de conocimientos",
  "administering_agency": "Ministerio de Relaciones Exteriores y Movilidad Humana",
  "format": {
    "question_count": null,
    "pass_mark": null,
    "pass_percent": 90,
    "time_limit_minutes": null,
    "question_pool_size": null,
    "modes": ["computer"],
    "notes": "Questions are drawn at random by the ministry’s system from a bank written by a committee (history, culture, geography and the country today)."
  },
  "languages": ["es"],
  "regional_variants": [],
  "exemptions": {
    "age": "Minors are excused. Older adults (adultos mayores) are excused from the examination but must still speak and write Spanish.",
    "disability": "People with an intellectual disability that deprives them of the use of reason are excused."
  },
  "fee": {
    "amount": 50,
    "currency": "USD",
    "covers": "The naturalization application."
  },
  "official_study_material": [],
  "last_researched_at": "2026-10-08T00:00:00Z",
  "citations": {
    "has_exam": [
      "https://www.gob.ec/mremh/tramites/obtencion-nacionalidad-ecuatoriana-carta-naturalizacion",
      "https://www.cancilleria.gob.ec/wp-content/uploads/2022/10/2022.09.07-Acuerdo-Ministerial-Nro.-0000081.pdf"
    ],
    "exam_name": [
      "https://www.gob.ec/mremh/tramites/obtencion-nacionalidad-ecuatoriana-carta-naturalizacion"
    ],
    "administering_agency": [
      "https://www.cancilleria.gob.ec/wp-content/uploads/2022/10/2022.09.07-Acuerdo-Ministerial-Nro.-0000081.pdf"
    ],
    "format": [
      "https://www.cancilleria.gob.ec/wp-content/uploads/2022/10/2022.09.07-Acuerdo-Ministerial-Nro.-0000081.pdf"
    ],
    "languages": [
      "https://www.gob.ec/mremh/tramites/obtencion-nacionalidad-ecuatoriana-carta-naturalizacion"
    ],
    "exemptions": [
      "https://www.gob.ec/mremh/tramites/obtencion-nacionalidad-ecuatoriana-carta-naturalizacion"
    ],
    "fee": [
      "https://www.gob.ec/mremh/tramites/obtencion-nacionalidad-ecuatoriana-carta-naturalizacion"
    ]
  },
  "unverified": {
    "regional_variants": "None described: one national test.",
    "official_study_material": "The question bank is internal; nothing published was found.",
    "format.question_count": "Reported as 30 questions with 27 needed; the figure was not found in the text read."
  },
  "confidence": "high",
  "recent_change": {
    "changed_on": null,
    "summary": "The procedure page now cites the Reglamento a la Ley Orgánica de Movilidad Humana of 2025 as its legal basis; the earlier rules came from a 2022 ministerial agreement.",
    "url": "https://www.gob.ec/mremh/tramites/obtencion-nacionalidad-ecuatoriana-carta-naturalizacion"
  },
  "notes": null
}
